09:28:32.403287 IP debian-s-1vcpu-1gb-lon1-01.ssh > 185.91.89.246.22646: Flags [P.], seq 1491698053:1491698169, ack 3092519198, win 501, options [nop,nop,TS val 971389640 ecr 2418364274], length 116
09:28:32.403334 IP debian-s-1vcpu-1gb-lon1-01.ssh > 185.91.89.246.22646: Flags [P.], seq 116:152, ack 1, win 501, options [nop,nop,TS val 971389640 ecr 2418364274], length 36
09:28:32.403369 IP debian-s-1vcpu-1gb-lon1-01.ssh > 185.91.89.246.22646: Flags [P.], seq 152:204, ack 1, win 501, options [nop,nop,TS val 971389640 ecr 2418364274], length 52
09:28:32.403400 IP debian-s-1vcpu-1gb-lon1-01.ssh > 185.91.89.246.22646: Flags [P.], seq 204:272, ack 1, win 501, options [nop,nop,TS val 971389640 ecr 2418364274], length 68
09:28:32.403430 IP debian-s-1vcpu-1gb-lon1-01.ssh > 185.91.89.246.22646: Flags [P.], seq 272:340, ack 1, win 501, options [nop,nop,TS val 971389640 ecr 2418364274], length 68
09:28:32.403456 IP debian-s-1vcpu-1gb-lon1-01.ssh > 185.91.89.246.22646: Flags [P.], seq 340:376, ack 1, win 501, options [nop,nop,TS val 971389640 ecr 2418364274], length 36
09:28:32.441012 IP 185.91.89.246.22646 > debian-s-1vcpu-1gb-lon1-01.ssh: Flags [.], ack 376, win 2041, options [nop,nop,TS val 2418364342 ecr 971389640], length 0
09:28:33.414844 IP debian-s-1vcpu-1gb-lon1-01.56284 > 67.207.67.2.domain: 2174+ PTR? 246.89.91.185.in-addr.arpa. (44)
09:28:33.441782 IP 67.207.67.2.domain > debian-s-1vcpu-1gb-lon1-01.56284: 2174 NXDomain 0/1/0 (100)
09:28:34.438086 IP debian-s-1vcpu-1gb-lon1-01.53234 > 67.207.67.2.domain: 20061+ PTR? 2.67.207.67.in-addr.arpa. (42)
09:28:34.438599 IP 67.207.67.2.domain > debian-s-1vcpu-1gb-lon1-01.53234: 20061 NXDomain 0/1/0 (109)
09:28:34.554450 IP prod-boron-sfo2-57.do.binaryedge.ninja.38094 > debian-s-1vcpu-1gb-lon1-01.2054: Flags [S], seq 610949257, win 65535, options [mss 1460], length 0
09:28:34.554518 IP debian-s-1vcpu-1gb-lon1-01.2054 > prod-boron-sfo2-57.do.binaryedge.ninja.38094: Flags [R.], seq 0, ack 610949258, win 0, length 0
09:28:35.462119 IP debian-s-1vcpu-1gb-lon1-01.39907 > 67.207.67.2.domain: 4309+ PTR? 114.143.22.165.in-addr.arpa. (45)
09:28:35.479625 IP 67.207.67.2.domain > debian-s-1vcpu-1gb-lon1-01.39907: 4309 1/0/0 PTR prod-boron-sfo2-57.do.binaryedge.ninja. (97)
09:28:37.403277 IP 31.173.147.62.46604 > debian-s-1vcpu-1gb-lon1-01.telnet: Flags [S], seq 2406394401, win 51627, length 0
09:28:37.403341 IP debian-s-1vcpu-1gb-lon1-01.telnet > 31.173.147.62.46604: Flags [R.], seq 0, ack 2406394402, win 0, length 0
09:28:37.510152 IP debian-s-1vcpu-1gb-lon1-01.51463 > 67.207.67.2.domain: 49723+ PTR? 62.147.173.31.in-addr.arpa. (44)
09:28:37.600828 IP 67.207.67.2.domain > debian-s-1vcpu-1gb-lon1-01.51463: 49723 NXDomain 0/1/0 (108)
09:28:44.386598 IP azpdes3k58zw.stretchoid.com.45287 > debian-s-1vcpu-1gb-lon1-01.1911: Flags [S], seq 3260739450, win 65535, options [mss 1440,nop,wscale 8,nop,nop,sackOK], length 0
09:28:44.386647 IP debian-s-1vcpu-1gb-lon1-01.1911 > azpdes3k58zw.stretchoid.com.45287: Flags [R.], seq 0, ack 3260739451, win 0, length 0
09:28:44.678063 IP debian-s-1vcpu-1gb-lon1-01.34601 > 67.207.67.2.domain: 21502+ PTR? 157.139.76.40.in-addr.arpa. (44)
09:28:44.684109 IP 67.207.67.2.domain > debian-s-1vcpu-1gb-lon1-01.34601: 21502 1/0/0 PTR azpdes3k58zw.stretchoid.com. (85)
09:28:47.901305 IP 185.91.89.246.3297 > debian-s-1vcpu-1gb-lon1-01.http: Flags [S], seq 2204459615, win 65535, options [mss 1460,nop,wscale 6,nop,nop,TS val 687018984 ecr 0,sackOK,eol], length 0
09:28:47.901362 IP debian-s-1vcpu-1gb-lon1-01.http > 185.91.89.246.3297: Flags [S.], seq 401458250, ack 2204459616, win 65160, options [mss 1460,sackOK,TS val 971405138 ecr 687018984,nop,wscale 7], length 0
09:28:47.901371 IP 185.91.89.246.14413 > debian-s-1vcpu-1gb-lon1-01.https: Flags [S], seq 116878277, win 65535, options [mss 1460,nop,wscale 6,nop,nop,TS val 8112838 ecr 0,sackOK,eol], length 0
09:28:47.901382 IP debian-s-1vcpu-1gb-lon1-01.https > 185.91.89.246.14413: Flags [R.], seq 0, ack 116878278, win 0, length 0
09:28:47.922206 IP 185.91.89.246.3297 > debian-s-1vcpu-1gb-lon1-01.http: Flags [.], ack 1, win 2058, options [nop,nop,TS val 687019011 ecr 971405138], length 0
09:28:47.922511 IP 185.91.89.246.3297 > debian-s-1vcpu-1gb-lon1-01.http: Flags [R.], seq 1, ack 1, win 2058, length 0
09:28:48.430706 IP 185.91.89.246.62643 > debian-s-1vcpu-1gb-lon1-01.domain: Flags [S], seq 3147191691, win 65535, options [mss 1460,nop,wscale 6,nop,nop,TS val 2218268367 ecr 0,sackOK,eol], length 0
09:28:48.430769 IP debian-s-1vcpu-1gb-lon1-01.domain > 185.91.89.246.62643: Flags [R.], seq 0, ack 3147191692, win 0, length 0
09:28:48.430928 IP 185.91.89.246.32191 > debian-s-1vcpu-1gb-lon1-01.ms-wbt-server: Flags [S], seq 886524648, win 65535, options [mss 1460,nop,wscale 6,nop,nop,TS val 4064537572 ecr 0,sackOK,eol], length 0
09:28:48.430943 IP debian-s-1vcpu-1gb-lon1-01.ms-wbt-server > 185.91.89.246.32191: Flags [R.], seq 0, ack 886524649, win 0, length 0
09:28:48.431076 IP 185.91.89.246.6920 > debian-s-1vcpu-1gb-lon1-01.8888: Flags [S], seq 3347167868, win 65535, options [mss 1460,nop,wscale 6,nop,nop,TS val 276060802 ecr 0,sackOK,eol], length 0
09:28:48.431082 IP debian-s-1vcpu-1gb-lon1-01.8888 > 185.91.89.246.6920: Flags [R.], seq 0, ack 3347167869, win 0, length 0
09:28:48.431189 IP 185.91.89.246.2674 > debian-s-1vcpu-1gb-lon1-01.https: Flags [S], seq 154017583, win 65535, options [mss 1460,nop,wscale 6,nop,nop,TS val 3486851707 ecr 0,sackOK,eol], length 0
09:28:48.431189 IP 185.91.89.246.40605 > debian-s-1vcpu-1gb-lon1-01.epmap: Flags [S], seq 3558759360, win 65535, options [mss 1460,nop,wscale 6,nop,nop,TS val 1580379710 ecr 0,sackOK,eol], length 0
09:28:48.431196 IP debian-s-1vcpu-1gb-lon1-01.https > 185.91.89.246.2674: Flags [R.], seq 0, ack 154017584, win 0, length 0
09:28:48.431203 IP debian-s-1vcpu-1gb-lon1-01.epmap > 185.91.89.246.40605: Flags [R.], seq 0, ack 3558759361, win 0, length 0
09:28:48.451287 IP 185.91.89.246.19516 > debian-s-1vcpu-1gb-lon1-01.ssh: Flags [S], seq 2044238231, win 65535, options [mss 1460,nop,wscale 6,nop,nop,TS val 931117075 ecr 0,sackOK,eol], length 0
09:28:48.451339 IP debian-s-1vcpu-1gb-lon1-01.ssh > 185.91.89.246.19516: Flags [S.], seq 2641598105, ack 2044238232, win 65160, options [mss 1460,sackOK,TS val 971405688 ecr 931117075,nop,wscale 7], length 0
09:28:48.451911 IP 185.91.89.246.30146 > debian-s-1vcpu-1gb-lon1-01.auth: Flags [S], seq 1968575397, win 65535, options [mss 1460,nop,wscale 6,nop,nop,TS val 1425089278 ecr 0,sackOK,eol], length 0
09:28:48.451925 IP debian-s-1vcpu-1gb-lon1-01.auth > 185.91.89.246.30146: Flags [R.], seq 0, ack 1968575398, win 0, length 0
09:28:48.452349 IP 185.91.89.246.56516 > debian-s-1vcpu-1gb-lon1-01.telnet: Flags [S], seq 2022226208, win 65535, options [mss 1460,nop,wscale 6,nop,nop,TS val 2324032347 ecr 0,sackOK,eol], length 0
09:28:48.452359 IP debian-s-1vcpu-1gb-lon1-01.telnet > 185.91.89.246.56516: Flags [R.], seq 0, ack 2022226209, win 0, length 0
09:28:48.452432 IP 185.91.89.246.52095 > debian-s-1vcpu-1gb-lon1-01.http-alt: Flags [S], seq 2782107794, win 65535, options [mss 1460,nop,wscale 6,nop,nop,TS val 705769695 ecr 0,sackOK,eol], length 0
09:28:48.452438 IP debian-s-1vcpu-1gb-lon1-01.http-alt > 185.91.89.246.52095: Flags [R.], seq 0, ack 2782107795, win 0, length 0
09:28:48.453885 IP 185.91.89.246.7462 > debian-s-1vcpu-1gb-lon1-01.rtsp: Flags [S], seq 3195716627, win 65535, options [mss 1460,nop,wscale 6,nop,nop,TS val 278803958 ecr 0,sackOK,eol], length 0
09:28:48.453930 IP debian-s-1vcpu-1gb-lon1-01.rtsp > 185.91.89.246.7462: Flags [R.], seq 0, ack 3195716628, win 0, length 0
09:28:48.512144 IP 185.91.89.246.19516 > debian-s-1vcpu-1gb-lon1-01.ssh: Flags [.], ack 1, win 2058, options [nop,nop,TS val 931117137 ecr 971405688], length 0
09:28:48.512472 IP 185.91.89.246.19516 > debian-s-1vcpu-1gb-lon1-01.ssh: Flags [R.], seq 1, ack 1, win 2058, length 0
09:28:48.513588 IP 185.91.89.246.17659 > debian-s-1vcpu-1gb-lon1-01.microsoft-ds: Flags [S], seq 25716024, win 65535, options [mss 1460,nop,wscale 6,nop,nop,TS val 3531560907 ecr 0,sackOK,eol], length 0
09:28:48.513621 IP debian-s-1vcpu-1gb-lon1-01.microsoft-ds > 185.91.89.246.17659: Flags [R.], seq 0, ack 25716025, win 0, length 0
09:28:48.513754 IP 185.91.89.246.24705 > debian-s-1vcpu-1gb-lon1-01.smux: Flags [S], seq 1114408194, win 65535, options [mss 1460,nop,wscale 6,nop,nop,TS val 82428508 ecr 0,sackOK,eol], length 0
09:28:48.513754 IP 185.91.89.246.48864 > debian-s-1vcpu-1gb-lon1-01.pop3s: Flags [S], seq 413465430, win 65535, options [mss 1460,nop,wscale 6,nop,nop,TS val 268012653 ecr 0,sackOK,eol], length 0
09:28:48.513768 IP debian-s-1vcpu-1gb-lon1-01.smux > 185.91.89.246.24705: Flags [R.], seq 0, ack 1114408195, win 0, length 0
09:28:48.513776 IP debian-s-1vcpu-1gb-lon1-01.pop3s > 185.91.89.246.48864: Flags [R.], seq 0, ack 413465431, win 0, length 0
09:28:48.515994 IP 185.91.89.246.61829 > debian-s-1vcpu-1gb-lon1-01.http: Flags [S], seq 3361688958, win 65535, options [mss 1460,nop,wscale 6,nop,nop,TS val 3406779168 ecr 0,sackOK,eol], length 0
09:28:48.516033 IP debian-s-1vcpu-1gb-lon1-01.http > 185.91.89.246.61829: Flags [S.], seq 1226471104, ack 3361688959, win 65160, options [mss 1460,sackOK,TS val 971405753 ecr 3406779168,nop,wscale 7], length 0
09:28:48.516169 IP 185.91.89.246.49889 > debian-s-1vcpu-1gb-lon1-01.smtp: Flags [S], seq 2101842636, win 65535, options [mss 1460,nop,wscale 6,nop,nop,TS val 2896563402 ecr 0,sackOK,eol], length 0
09:28:48.516180 IP debian-s-1vcpu-1gb-lon1-01.smtp > 185.91.89.246.49889: Flags [R.], seq 0, ack 2101842637, win 0, length 0
09:28:48.533647 IP 185.91.89.246.20572 > debian-s-1vcpu-1gb-lon1-01.imap2: Flags [S], seq 2235563232, win 65535, options [mss 1460,nop,wscale 6,nop,nop,TS val 811665763 ecr 0,sackOK,eol], length 0
09:28:48.533720 IP debian-s-1vcpu-1gb-lon1-01.imap2 > 185.91.89.246.20572: Flags [R.], seq 0, ack 2235563233, win 0, length 0
09:28:48.533749 IP 185.91.89.246.6884 > debian-s-1vcpu-1gb-lon1-01.sunrpc: Flags [S], seq 3190092548, win 65535, options [mss 1460,nop,wscale 6,nop,nop,TS val 3825219883 ecr 0,sackOK,eol], length 0
09:28:48.533756 IP debian-s-1vcpu-1gb-lon1-01.sunrpc > 185.91.89.246.6884: Flags [R.], seq 0, ack 3190092549, win 0, length 0
09:28:48.535047 IP 185.91.89.246.27566 > debian-s-1vcpu-1gb-lon1-01.imaps: Flags [S], seq 1101697676, win 65535, options [mss 1460,nop,wscale 6,nop,nop,TS val 2122855086 ecr 0,sackOK,eol], length 0
09:28:48.535057 IP debian-s-1vcpu-1gb-lon1-01.imaps > 185.91.89.246.27566: Flags [R.], seq 0, ack 1101697677, win 0, length 0
09:28:48.536527 IP 185.91.89.246.25733 > debian-s-1vcpu-1gb-lon1-01.1025: Flags [S], seq 1414054187, win 65535, options [mss 1460,nop,wscale 6,nop,nop,TS val 2515860828 ecr 0,sackOK,eol], length 0
09:28:48.536556 IP debian-s-1vcpu-1gb-lon1-01.1025 > 185.91.89.246.25733: Flags [R.], seq 0, ack 1414054188, win 0, length 0
09:28:48.536702 IP 185.91.89.246.61829 > debian-s-1vcpu-1gb-lon1-01.http: Flags [.], ack 1, win 2058, options [nop,nop,TS val 3406779189 ecr 971405753], length 0
09:28:48.536714 IP 185.91.89.246.61829 > debian-s-1vcpu-1gb-lon1-01.http: Flags [R.], seq 1, ack 1, win 2058, length 0
09:28:48.538388 IP 185.91.89.246.62911 > debian-s-1vcpu-1gb-lon1-01.256: Flags [S], seq 1956430302, win 65535, options [mss 1460,nop,wscale 6,nop,nop,TS val 999037527 ecr 0,sackOK,eol], length 0
09:28:48.538414 IP debian-s-1vcpu-1gb-lon1-01.256 > 185.91.89.246.62911: Flags [R.], seq 0, ack 1956430303, win 0, length 0
09:28:48.554326 IP 185.91.89.246.58031 > debian-s-1vcpu-1gb-lon1-01.1720: Flags [S], seq 549794738, win 65535, options [mss 1460,nop,wscale 6,nop,nop,TS val 648415056 ecr 0,sackOK,eol], length 0
09:28:48.554385 IP debian-s-1vcpu-1gb-lon1-01.1720 > 185.91.89.246.58031: Flags [R.], seq 0, ack 549794739, win 0, length 0
09:28:48.554975 IP 185.91.89.246.32217 > debian-s-1vcpu-1gb-lon1-01.ftp: Flags [S], seq 3001344161, win 65535, options [mss 1460,nop,wscale 6,nop,nop,TS val 991733774 ecr 0,sackOK,eol], length 0
09:28:48.555008 IP debian-s-1vcpu-1gb-lon1-01.ftp > 185.91.89.246.32217: Flags [R.], seq 0, ack 3001344162, win 0, length 0
09:28:48.557535 IP 185.91.89.246.36778 > debian-s-1vcpu-1gb-lon1-01.mysql: Flags [S], seq 1285026052, win 65535, options [mss 1460,nop,wscale 6,nop,nop,TS val 549303550 ecr 0,sackOK,eol], length 0
09:28:48.557584 IP debian-s-1vcpu-1gb-lon1-01.mysql > 185.91.89.246.36778: Flags [R.], seq 0, ack 1285026053, win 0, length 0
09:28:48.558050 IP 185.91.89.246.7684 > debian-s-1vcpu-1gb-lon1-01.5900: Flags [S], seq 2780742598, win 65535, options [mss 1460,nop,wscale 6,nop,nop,TS val 3002410157 ecr 0,sackOK,eol], length 0
09:28:48.558070 IP debian-s-1vcpu-1gb-lon1-01.5900 > 185.91.89.246.7684: Flags [R.], seq 0, ack 2780742599, win 0, length 0
09:28:48.558890 IP 185.91.89.246.39483 > debian-s-1vcpu-1gb-lon1-01.submission: Flags [S], seq 1106170815, win 65535, options [mss 1460,nop,wscale 6,nop,nop,TS val 7295172 ecr 0,sackOK,eol], length 0
09:28:48.558912 IP debian-s-1vcpu-1gb-lon1-01.submission > 185.91.89.246.39483: Flags [R.], seq 0, ack 1106170816, win 0, length 0
09:28:48.575197 IP 185.91.89.246.18140 > debian-s-1vcpu-1gb-lon1-01.1723: Flags [S], seq 3750937863, win 65535, options [mss 1460,nop,wscale 6,nop,nop,TS val 304367412 ecr 0,sackOK,eol], length 0
09:28:48.575260 IP debian-s-1vcpu-1gb-lon1-01.1723 > 185.91.89.246.18140: Flags [R.], seq 0, ack 3750937864, win 0, length 0
09:28:48.576607 IP 185.91.89.246.21131 > debian-s-1vcpu-1gb-lon1-01.pop3: Flags [S], seq 204927016, win 65535, options [mss 1460,nop,wscale 6,nop,nop,TS val 1039246851 ecr 0,sackOK,eol], length 0
09:28:48.576643 IP debian-s-1vcpu-1gb-lon1-01.pop3 > 185.91.89.246.21131: Flags [R.], seq 0, ack 204927017, win 0, length 0
09:28:48.576922 IP 185.91.89.246.16447 > debian-s-1vcpu-1gb-lon1-01.netbios-ssn: Flags [S], seq 1668533802, win 65535, options [mss 1460,nop,wscale 6,nop,nop,TS val 794002413 ecr 0,sackOK,eol], length 0
09:28:48.576937 IP debian-s-1vcpu-1gb-lon1-01.netbios-ssn > 185.91.89.246.16447: Flags [R.], seq 0, ack 1668533803, win 0, length 0
09:28:48.579575 IP 185.91.89.246.1445 > debian-s-1vcpu-1gb-lon1-01.6129: Flags [S], seq 4168615495, win 65535, options [mss 1460,nop,wscale 6,nop,nop,TS val 343419011 ecr 0,sackOK,eol], length 0
09:28:48.579614 IP debian-s-1vcpu-1gb-lon1-01.6129 > 185.91.89.246.1445: Flags [R.], seq 0, ack 4168615496, win 0, length 0
09:28:48.580871 IP 185.91.89.246.57122 > debian-s-1vcpu-1gb-lon1-01.bgpd: Flags [S], seq 327928622, win 65535, options [mss 1460,nop,wscale 6,nop,nop,TS val 3423287184 ecr 0,sackOK,eol], length 0
09:28:48.580903 IP debian-s-1vcpu-1gb-lon1-01.bgpd > 185.91.89.246.57122: Flags [R.], seq 0, ack 327928623, win 0, length 0
09:28:48.596488 IP 185.91.89.246.21432 > debian-s-1vcpu-1gb-lon1-01.3000: Flags [S], seq 366134442, win 65535, options [mss 1460,nop,wscale 6,nop,nop,TS val 1539037194 ecr 0,sackOK,eol], length 0
09:28:48.596545 IP debian-s-1vcpu-1gb-lon1-01.3000 > 185.91.89.246.21432: Flags [R.], seq 0, ack 366134443, win 0, length 0
09:28:48.597038 IP 185.91.89.246.58846 > debian-s-1vcpu-1gb-lon1-01.2179: Flags [S], seq 3203124786, win 65535, options [mss 1460,nop,wscale 6,nop,nop,TS val 133635644 ecr 0,sackOK,eol], length 0
09:28:48.597113 IP debian-s-1vcpu-1gb-lon1-01.2179 > 185.91.89.246.58846: Flags [R.], seq 0, ack 3203124787, win 0, length 0
09:28:48.597934 IP 185.91.89.246.20055 > debian-s-1vcpu-1gb-lon1-01.32771: Flags [S], seq 3394905572, win 65535, options [mss 1460,nop,wscale 6,nop,nop,TS val 3838068848 ecr 0,sackOK,eol], length 0
09:28:48.597962 IP debian-s-1vcpu-1gb-lon1-01.32771 > 185.91.89.246.20055: Flags [R.], seq 0, ack 3394905573, win 0, length 0
09:28:48.600432 IP 185.91.89.246.11882 > debian-s-1vcpu-1gb-lon1-01.1947: Flags [S], seq 2171070454, win 65535, options [mss 1460,nop,wscale 6,nop,nop,TS val 2310060062 ecr 0,sackOK,eol], length 0
09:28:48.600469 IP debian-s-1vcpu-1gb-lon1-01.1947 > 185.91.89.246.11882: Flags [R.], seq 0, ack 2171070455, win 0, length 0
09:28:48.603005 IP 185.91.89.246.10405 > debian-s-1vcpu-1gb-lon1-01.2251: Flags [S], seq 3909789059, win 65535, options [mss 1460,nop,wscale 6,nop,nop,TS val 3377119969 ecr 0,sackOK,eol], length 0
09:28:48.603038 IP debian-s-1vcpu-1gb-lon1-01.2251 > 185.91.89.246.10405: Flags [R.], seq 0, ack 3909789060, win 0, length 0
09:28:48.617178 IP 185.91.89.246.22721 > debian-s-1vcpu-1gb-lon1-01.1216: Flags [S], seq 2522014265, win 65535, options [mss 1460,nop,wscale 6,nop,nop,TS val 1404149130 ecr 0,sackOK,eol], length 0
09:28:48.617225 IP debian-s-1vcpu-1gb-lon1-01.1216 > 185.91.89.246.22721: Flags [R.], seq 0, ack 2522014266, win 0, length 0
09:28:48.618595 IP 185.91.89.246.10379 > debian-s-1vcpu-1gb-lon1-01.2002: Flags [S], seq 2197311431, win 65535, options [mss 1460,nop,wscale 6,nop,nop,TS val 4267515463 ecr 0,sackOK,eol], length 0
09:28:48.618607 IP debian-s-1vcpu-1gb-lon1-01.2002 > 185.91.89.246.10379: Flags [R.], seq 0, ack 2197311432, win 0, length 0
09:28:48.619640 IP 185.91.89.246.33602 > debian-s-1vcpu-1gb-lon1-01.2022: Flags [S], seq 881157425, win 65535, options [mss 1460,nop,wscale 6,nop,nop,TS val 1944802495 ecr 0,sackOK,eol], length 0
09:28:48.619663 IP debian-s-1vcpu-1gb-lon1-01.2022 > 185.91.89.246.33602: Flags [R.], seq 0, ack 881157426, win 0, length 0
09:28:48.621757 IP 185.91.89.246.26944 > debian-s-1vcpu-1gb-lon1-01.3300: Flags [S], seq 1347199116, win 65535, options [mss 1460,nop,wscale 6,nop,nop,TS val 2477850236 ecr 0,sackOK,eol], length 0
09:28:48.621772 IP debian-s-1vcpu-1gb-lon1-01.3300 > 185.91.89.246.26944: Flags [R.], seq 0, ack 1347199117, win 0, length 0
09:28:48.625564 IP 185.91.89.246.58998 > debian-s-1vcpu-1gb-lon1-01.3659: Flags [S], seq 3372999315, win 65535, options [mss 1460,nop,wscale 6,nop,nop,TS val 335978884 ecr 0,sackOK,eol], length 0
09:28:48.625594 IP debian-s-1vcpu-1gb-lon1-01.3659 > 185.91.89.246.58998: Flags [R.], seq 0, ack 3372999316, win 0, length 0
09:28:48.639001 IP 185.91.89.246.58534 > debian-s-1vcpu-1gb-lon1-01.683: Flags [S], seq 1206947796, win 65535, options [mss 1460,nop,wscale 6,nop,nop,TS val 4228100075 ecr 0,sackOK,eol], length 0
09:28:48.639056 IP debian-s-1vcpu-1gb-lon1-01.683 > 185.91.89.246.58534: Flags [R.], seq 0, ack 1206947797, win 0, length 0
09:28:48.639198 IP 185.91.89.246.8796 > debian-s-1vcpu-1gb-lon1-01.3052: Flags [S], seq 1758192808, win 65535, options [mss 1460,nop,wscale 6,nop,nop,TS val 2707285297 ecr 0,sackOK,eol], length 0
09:28:48.639206 IP debian-s-1vcpu-1gb-lon1-01.3052 > 185.91.89.246.8796: Flags [R.], seq 0, ack 1758192809, win 0, length 0
09:28:48.639378 IP 185.91.89.246.43864 > debian-s-1vcpu-1gb-lon1-01.17877: Flags [S], seq 3320733775, win 65535, options [mss 1460,nop,wscale 6,nop,nop,TS val 2770112906 ecr 0,sackOK,eol], length 0
09:28:48.639384 IP debian-s-1vcpu-1gb-lon1-01.17877 > 185.91.89.246.43864: Flags [R.], seq 0, ack 3320733776, win 0, length 0
09:28:48.643614 IP 185.91.89.246.52419 > debian-s-1vcpu-1gb-lon1-01.10626: Flags [S], seq 4053983003, win 65535, options [mss 1460,nop,wscale 6,nop,nop,TS val 584611724 ecr 0,sackOK,eol], length 0
09:28:48.643663 IP debian-s-1vcpu-1gb-lon1-01.10626 > 185.91.89.246.52419: Flags [R.], seq 0, ack 4053983004, win 0, length 0
09:28:48.647699 IP 185.91.89.246.45446 > debian-s-1vcpu-1gb-lon1-01.911: Flags [S], seq 4056807997, win 65535, options [mss 1460,nop,wscale 6,nop,nop,TS val 1779032696 ecr 0,sackOK,eol], length 0
09:28:48.647748 IP debian-s-1vcpu-1gb-lon1-01.911 > 185.91.89.246.45446: Flags [R.], seq 0, ack 4056807998, win 0, length 0
09:28:48.660555 IP 185.91.89.246.42375 > debian-s-1vcpu-1gb-lon1-01.2001: Flags [S], seq 845146208, win 65535, options [mss 1460,nop,wscale 6,nop,nop,TS val 2243138794 ecr 0,sackOK,eol], length 0
09:28:48.660608 IP debian-s-1vcpu-1gb-lon1-01.2001 > 185.91.89.246.42375: Flags [R.], seq 0, ack 845146209, win 0, length 0
09:28:48.662032 IP 185.91.89.246.23822 > debian-s-1vcpu-1gb-lon1-01.6881: Flags [S], seq 148057884, win 65535, options [mss 1460,nop,wscale 6,nop,nop,TS val 3795592837 ecr 0,sackOK,eol], length 0
09:28:48.662064 IP debian-s-1vcpu-1gb-lon1-01.6881 > 185.91.89.246.23822: Flags [R.], seq 0, ack 148057885, win 0, length 0
09:28:48.662278 IP 185.91.89.246.29597 > debian-s-1vcpu-1gb-lon1-01.1688: Flags [S], seq 1406590213, win 65535, options [mss 1460,nop,wscale 6,nop,nop,TS val 1641247056 ecr 0,sackOK,eol], length 0
09:28:48.662285 IP debian-s-1vcpu-1gb-lon1-01.1688 > 185.91.89.246.29597: Flags [R.], seq 0, ack 1406590214, win 0, length 0
09:28:48.696719 IP 185.91.89.246.46022 > debian-s-1vcpu-1gb-lon1-01.32781: Flags [S], seq 1276198245, win 65535, options [mss 1460,nop,wscale 6,nop,nop,TS val 1818589920 ecr 0,sackOK,eol], length 0
09:28:48.696767 IP debian-s-1vcpu-1gb-lon1-01.32781 > 185.91.89.246.46022: Flags [R.], seq 0, ack 1276198246, win 0, length 0
09:28:48.697446 IP 185.91.89.246.48849 > debian-s-1vcpu-1gb-lon1-01.144: Flags [S], seq 2222420923, win 65535, options [mss 1460,nop,wscale 6,nop,nop,TS val 245556057 ecr 0,sackOK,eol], length 0
09:28:48.697466 IP debian-s-1vcpu-1gb-lon1-01.144 > 185.91.89.246.48849: Flags [R.], seq 0, ack 2222420924, win 0, length 0
09:28:48.698606 IP 185.91.89.246.56778 > debian-s-1vcpu-1gb-lon1-01.submissions: Flags [S], seq 3338734151, win 65535, options [mss 1460,nop,wscale 6,nop,nop,TS val 3350730834 ecr 0,sackOK,eol], length 0
09:28:48.698632 IP debian-s-1vcpu-1gb-lon1-01.submissions > 185.91.89.246.56778: Flags [R.], seq 0, ack 3338734152, win 0, length 0
09:28:48.699837 IP 185.91.89.246.54010 > debian-s-1vcpu-1gb-lon1-01.13783: Flags [S], seq 2495366579, win 65535, options [mss 1460,nop,wscale 6,nop,nop,TS val 3127169523 ecr 0,sackOK,eol], length 0
09:28:48.699853 IP debian-s-1vcpu-1gb-lon1-01.13783 > 185.91.89.246.54010: Flags [R.], seq 0, ack 2495366580, win 0, length 0
09:28:48.700644 IP 185.91.89.246.30284 > debian-s-1vcpu-1gb-lon1-01.85: Flags [S], seq 2401316711, win 65535, options [mss 1460,nop,wscale 6,nop,nop,TS val 2254762337 ecr 0,sackOK,eol], length 0
09:28:48.700673 IP debian-s-1vcpu-1gb-lon1-01.85 > 185.91.89.246.30284: Flags [R.], seq 0, ack 2401316712, win 0, length 0
09:28:48.717911 IP 185.91.89.246.39864 > debian-s-1vcpu-1gb-lon1-01.nntp: Flags [S], seq 4115715849, win 65535, options [mss 1460,nop,wscale 6,nop,nop,TS val 3915939082 ecr 0,sackOK,eol], length 0
09:28:48.717963 IP debian-s-1vcpu-1gb-lon1-01.nntp > 185.91.89.246.39864: Flags [R.], seq 0, ack 4115715850, win 0, length 0
09:28:48.718334 IP 185.91.89.246.21544 > debian-s-1vcpu-1gb-lon1-01.moira-update: Flags [S], seq 3211562005, win 65535, options [mss 1460,nop,wscale 6,nop,nop,TS val 366630822 ecr 0,sackOK,eol], length 0
09:28:48.718346 IP debian-s-1vcpu-1gb-lon1-01.moira-update > 185.91.89.246.21544: Flags [R.], seq 0, ack 3211562006, win 0, length 0
09:28:48.719990 IP 185.91.89.246.14116 > debian-s-1vcpu-1gb-lon1-01.3404: Flags [S], seq 1618623636, win 65535, options [mss 1460,nop,wscale 6,nop,nop,TS val 1524970570 ecr 0,sackOK,eol], length 0
09:28:48.720019 IP debian-s-1vcpu-1gb-lon1-01.3404 > 185.91.89.246.14116: Flags [R.], seq 0, ack 1618623637, win 0, length 0
09:28:48.720172 IP 185.91.89.246.48043 > debian-s-1vcpu-1gb-lon1-01.407: Flags [S], seq 509007951, win 65535, options [mss 1460,nop,wscale 6,nop,nop,TS val 2531690153 ecr 0,sackOK,eol], length 0
09:28:48.720178 IP debian-s-1vcpu-1gb-lon1-01.407 > 185.91.89.246.48043: Flags [R.], seq 0, ack 509007952, win 0, length 0
09:28:48.722452 IP 185.91.89.246.41926 > debian-s-1vcpu-1gb-lon1-01.20031: Flags [S], seq 1496457313, win 65535, options [mss 1460,nop,wscale 6,nop,nop,TS val 25665785 ecr 0,sackOK,eol], length 0
09:28:48.722469 IP debian-s-1vcpu-1gb-lon1-01.20031 > 185.91.89.246.41926: Flags [R.], seq 0, ack 1496457314, win 0, length 0
09:28:48.740451 IP 185.91.89.246.38818 > debian-s-1vcpu-1gb-lon1-01.1062: Flags [S], seq 829924369, win 65535, options [mss 1460,nop,wscale 6,nop,nop,TS val 1555419627 ecr 0,sackOK,eol], length 0
09:28:48.740501 IP debian-s-1vcpu-1gb-lon1-01.1062 > 185.91.89.246.38818: Flags [R.], seq 0, ack 829924370, win 0, length 0
09:28:48.740609 IP 185.91.89.246.41442 > debian-s-1vcpu-1gb-lon1-01.ripd: Flags [S], seq 1636851875, win 65535, options [mss 1460,nop,wscale 6,nop,nop,TS val 2167434863 ecr 0,sackOK,eol], length 0
09:28:48.740619 IP debian-s-1vcpu-1gb-lon1-01.ripd > 185.91.89.246.41442: Flags [R.], seq 0, ack 1636851876, win 0, length 0
09:28:48.740676 IP 185.91.89.246.17735 > debian-s-1vcpu-1gb-lon1-01.48080: Flags [S], seq 2743541959, win 65535, options [mss 1460,nop,wscale 6,nop,nop,TS val 449659594 ecr 0,sackOK,eol], length 0
09:28:48.740682 IP debian-s-1vcpu-1gb-lon1-01.48080 > 185.91.89.246.17735: Flags [R.], seq 0, ack 2743541960, win 0, length 0
09:28:48.741906 IP 185.91.89.246.26130 > debian-s-1vcpu-1gb-lon1-01.9011: Flags [S], seq 570808899, win 65535, options [mss 1460,nop,wscale 6,nop,nop,TS val 113822477 ecr 0,sackOK,eol], length 0
09:28:48.741931 IP debian-s-1vcpu-1gb-lon1-01.9011 > 185.91.89.246.26130: Flags [R.], seq 0, ack 570808900, win 0, length 0
09:28:48.743387 IP 185.91.89.246.19622 > debian-s-1vcpu-1gb-lon1-01.49152: Flags [S], seq 80725427, win 65535, options [mss 1460,nop,wscale 6,nop,nop,TS val 412528488 ecr 0,sackOK,eol], length 0
09:28:48.743420 IP debian-s-1vcpu-1gb-lon1-01.49152 > 185.91.89.246.19622: Flags [R.], seq 0, ack 80725428, win 0, length 0
09:28:48.762560 IP 185.91.89.246.55053 > debian-s-1vcpu-1gb-lon1-01.1971: Flags [S], seq 632333655, win 65535, options [mss 1460,nop,wscale 6,nop,nop,TS val 1416454332 ecr 0,sackOK,eol], length 0
09:28:48.762609 IP debian-s-1vcpu-1gb-lon1-01.1971 > 185.91.89.246.55053: Flags [R.], seq 0, ack 632333656, win 0, length 0
09:28:48.762715 IP 185.91.89.246.40239 > debian-s-1vcpu-1gb-lon1-01.44442: Flags [S], seq 1061574856, win 65535, options [mss 1460,nop,wscale 6,nop,nop,TS val 3998740235 ecr 0,sackOK,eol], length 0
09:28:48.762725 IP debian-s-1vcpu-1gb-lon1-01.44442 > 185.91.89.246.40239: Flags [R.], seq 0, ack 1061574857, win 0, length 0
09:28:48.763045 IP 185.91.89.246.34096 > debian-s-1vcpu-1gb-lon1-01.31337: Flags [S], seq 1814101598, win 65535, options [mss 1460,nop,wscale 6,nop,nop,TS val 1767321935 ecr 0,sackOK,eol], length 0
09:28:48.763062 IP debian-s-1vcpu-1gb-lon1-01.31337 > 185.91.89.246.34096: Flags [R.], seq 0, ack 1814101599, win 0, length 0
09:28:48.764425 IP 185.91.89.246.6876 > debian-s-1vcpu-1gb-lon1-01.1054: Flags [S], seq 765112106, win 65535, options [mss 1460,nop,wscale 6,nop,nop,TS val 3389271209 ecr 0,sackOK,eol], length 0
09:28:48.764472 IP debian-s-1vcpu-1gb-lon1-01.1054 > 185.91.89.246.6876: Flags [R.], seq 0, ack 765112107, win 0, length 0
09:28:48.764880 IP 185.91.89.246.33966 > debian-s-1vcpu-1gb-lon1-01.125: Flags [S], seq 3872425658, win 65535, options [mss 1460,nop,wscale 6,nop,nop,TS val 2672385110 ecr 0,sackOK,eol], length 0
09:28:48.764907 IP debian-s-1vcpu-1gb-lon1-01.125 > 185.91.89.246.33966: Flags [R.], seq 0, ack 3872425659, win 0, length 0
09:28:48.782770 IP 185.91.89.246.27347 > debian-s-1vcpu-1gb-lon1-01.ipp: Flags [S], seq 849855808, win 65535, options [mss 1460,nop,wscale 6,nop,nop,TS val 2120953686 ecr 0,sackOK,eol], length 0
09:28:48.782831 IP debian-s-1vcpu-1gb-lon1-01.ipp > 185.91.89.246.27347: Flags [R.], seq 0, ack 849855809, win 0, length 0
09:28:48.783788 IP 185.91.89.246.38177 > debian-s-1vcpu-1gb-lon1-01.1022: Flags [S], seq 302661321, win 65535, options [mss 1460,nop,wscale 6,nop,nop,TS val 3706864520 ecr 0,sackOK,eol], length 0
09:28:48.783819 IP debian-s-1vcpu-1gb-lon1-01.1022 > 185.91.89.246.38177: Flags [R.], seq 0, ack 302661322, win 0, length 0
09:28:48.786218 IP 185.91.89.246.20571 > debian-s-1vcpu-1gb-lon1-01.1984: Flags [S], seq 2249966097, win 65535, options [mss 1460,nop,wscale 6,nop,nop,TS val 2603337495 ecr 0,sackOK,eol], length 0
09:28:48.786269 IP debian-s-1vcpu-1gb-lon1-01.1984 > 185.91.89.246.20571: Flags [R.], seq 0, ack 2249966098, win 0, length 0
09:28:48.786399 IP 185.91.89.246.16122 > debian-s-1vcpu-1gb-lon1-01.1805: Flags [S], seq 2503187059, win 65535, options [mss 1460,nop,wscale 6,nop,nop,TS val 251667259 ecr 0,sackOK,eol], length 0
09:28:48.786413 IP debian-s-1vcpu-1gb-lon1-01.1805 > 185.91.89.246.16122: Flags [R.], seq 0, ack 2503187060, win 0, length 0
09:28:48.788560 IP 185.91.89.246.30381 > debian-s-1vcpu-1gb-lon1-01.1185: Flags [S], seq 3459787185, win 65535, options [mss 1460,nop,wscale 6,nop,nop,TS val 3435118395 ecr 0,sackOK,eol], length 0
09:28:48.788604 IP debian-s-1vcpu-1gb-lon1-01.1185 > 185.91.89.246.30381: Flags [R.], seq 0, ack 3459787186, win 0, length 0
09:28:48.803435 IP 185.91.89.246.18869 > debian-s-1vcpu-1gb-lon1-01.ldap: Flags [S], seq 3959543793, win 65535, options [mss 1460,nop,wscale 6,nop,nop,TS val 2710994921 ecr 0,sackOK,eol], length 0
09:28:48.803487 IP debian-s-1vcpu-1gb-lon1-01.ldap > 185.91.89.246.18869: Flags [R.], seq 0, ack 3959543794, win 0, length 0
09:28:48.803498 IP 185.91.89.246.19451 > debian-s-1vcpu-1gb-lon1-01.3283: Flags [S], seq 694255194, win 65535, options [mss 1460,nop,wscale 6,nop,nop,TS val 271157069 ecr 0,sackOK,eol], length 0
09:28:48.803504 IP debian-s-1vcpu-1gb-lon1-01.3283 > 185.91.89.246.19451: Flags [R.], seq 0, ack 694255195, win 0, length 0
09:28:48.806859 IP 185.91.89.246.19767 > debian-s-1vcpu-1gb-lon1-01.843: Flags [S], seq 1173855293, win 65535, options [mss 1460,nop,wscale 6,nop,nop,TS val 901330162 ecr 0,sackOK,eol], length 0
09:28:48.806914 IP debian-s-1vcpu-1gb-lon1-01.843 > 185.91.89.246.19767: Flags [R.], seq 0, ack 1173855294, win 0, length 0
09:28:48.808825 IP 185.91.89.246.12831 > debian-s-1vcpu-1gb-lon1-01.9003: Flags [S], seq 3997397045, win 65535, options [mss 1460,nop,wscale 6,nop,nop,TS val 1664838850 ecr 0,sackOK,eol], length 0
09:28:48.808866 IP debian-s-1vcpu-1gb-lon1-01.9003 > 185.91.89.246.12831: Flags [R.], seq 0, ack 3997397046, win 0, length 0
09:28:48.809671 IP 185.91.89.246.32847 > debian-s-1vcpu-1gb-lon1-01.50002: Flags [S], seq 2071057001, win 65535, options [mss 1460,nop,wscale 6,nop,nop,TS val 1590550230 ecr 0,sackOK,eol], length 0
09:28:48.809695 IP debian-s-1vcpu-1gb-lon1-01.50002 > 185.91.89.246.32847: Flags [R.], seq 0, ack 2071057002, win 0, length 0
09:28:48.825260 IP 185.91.89.246.34525 > debian-s-1vcpu-1gb-lon1-01.2038: Flags [S], seq 312290521, win 65535, options [mss 1460,nop,wscale 6,nop,nop,TS val 4283068634 ecr 0,sackOK,eol], length 0
09:28:48.825326 IP debian-s-1vcpu-1gb-lon1-01.2038 > 185.91.89.246.34525: Flags [R.], seq 0, ack 312290522, win 0, length 0
09:28:48.826065 IP 185.91.89.246.31257 > debian-s-1vcpu-1gb-lon1-01.19842: Flags [S], seq 2278048199, win 65535, options [mss 1460,nop,wscale 6,nop,nop,TS val 3114966063 ecr 0,sackOK,eol], length 0
09:28:48.826098 IP debian-s-1vcpu-1gb-lon1-01.19842 > 185.91.89.246.31257: Flags [R.], seq 0, ack 2278048200, win 0, length 0
09:28:48.826304 IP 185.91.89.246.62567 > debian-s-1vcpu-1gb-lon1-01.1111: Flags [S], seq 1173068130, win 65535, options [mss 1460,nop,wscale 6,nop,nop,TS val 2406612917 ecr 0,sackOK,eol], length 0
09:28:48.826312 IP debian-s-1vcpu-1gb-lon1-01.1111 > 185.91.89.246.62567: Flags [R.], seq 0, ack 1173068131, win 0, length 0
09:28:48.830549 IP 185.91.89.246.9966 > debian-s-1vcpu-1gb-lon1-01.32779: Flags [S], seq 3645194546, win 65535, options [mss 1460,nop,wscale 6,nop,nop,TS val 527356108 ecr 0,sackOK,eol], length 0
09:28:48.830599 IP debian-s-1vcpu-1gb-lon1-01.32779 > 185.91.89.246.9966: Flags [R.], seq 0, ack 3645194547, win 0, length 0
09:28:48.833674 IP 185.91.89.246.56974 > debian-s-1vcpu-1gb-lon1-01.5298: Flags [S], seq 708622953, win 65535, options [mss 1460,nop,wscale 6,nop,nop,TS val 2403693366 ecr 0,sackOK,eol], length 0
09:28:48.833730 IP debian-s-1vcpu-1gb-lon1-01.5298 > 185.91.89.246.56974: Flags [R.], seq 0, ack 708622954, win 0, length 0
09:28:48.845217 IP 185.91.89.246.62361 > debian-s-1vcpu-1gb-lon1-01.625: Flags [S], seq 4230930591, win 65535, options [mss 1460,nop,wscale 6,nop,nop,TS val 2907621089 ecr 0,sackOK,eol], length 0
09:28:48.845268 IP debian-s-1vcpu-1gb-lon1-01.625 > 185.91.89.246.62361: Flags [R.], seq 0, ack 4230930592, win 0, length 0
09:28:48.847795 IP 185.91.89.246.51810 > debian-s-1vcpu-1gb-lon1-01.4343: Flags [S], seq 1351914163, win 65535, options [mss 1460,nop,wscale 6,nop,nop,TS val 429936126 ecr 0,sackOK,eol], length 0
09:28:48.847837 IP debian-s-1vcpu-1gb-lon1-01.4343 > 185.91.89.246.51810: Flags [R.], seq 0, ack 1351914164, win 0, length 0
09:28:48.848100 IP 185.91.89.246.14554 > debian-s-1vcpu-1gb-lon1-01.5902: Flags [S], seq 3740228788, win 65535, options [mss 1460,nop,wscale 6,nop,nop,TS val 1312027289 ecr 0,sackOK,eol], length 0
09:28:48.848107 IP debian-s-1vcpu-1gb-lon1-01.5902 > 185.91.89.246.14554: Flags [R.], seq 0, ack 3740228789, win 0, length 0
09:28:48.850715 IP 185.91.89.246.58611 > debian-s-1vcpu-1gb-lon1-01.55055: Flags [S], seq 3922969386, win 65535, options [mss 1460,nop,wscale 6,nop,nop,TS val 3446095092 ecr 0,sackOK,eol], length 0
09:28:48.850752 IP debian-s-1vcpu-1gb-lon1-01.55055 > 185.91.89.246.58611: Flags [R.], seq 0, ack 3922969387, win 0, length 0
09:28:48.853463 IP 185.91.89.246.57735 > debian-s-1vcpu-1gb-lon1-01.zebra: Flags [S], seq 1990125461, win 65535, options [mss 1460,nop,wscale 6,nop,nop,TS val 3258153122 ecr 0,sackOK,eol], length 0
09:28:48.853493 IP debian-s-1vcpu-1gb-lon1-01.zebra > 185.91.89.246.57735: Flags [R.], seq 0, ack 1990125462, win 0, length 0
09:28:48.866978 IP 185.91.89.246.22080 > debian-s-1vcpu-1gb-lon1-01.17988: Flags [S], seq 2532146390, win 65535, options [mss 1460,nop,wscale 6,nop,nop,TS val 4189933158 ecr 0,sackOK,eol], length 0
09:28:48.867026 IP debian-s-1vcpu-1gb-lon1-01.17988 > 185.91.89.246.22080: Flags [R.], seq 0, ack 2532146391, win 0, length 0
09:28:48.905801 IP 185.91.89.246.15179 > debian-s-1vcpu-1gb-lon1-01.3323: Flags [S], seq 279053333, win 65535, options [mss 1460,nop,wscale 6,nop,nop,TS val 2586088488 ecr 0,sackOK,eol], length 0
09:28:48.905852 IP debian-s-1vcpu-1gb-lon1-01.3323 > 185.91.89.246.15179: Flags [R.], seq 0, ack 279053334, win 0, length 0
09:28:48.906037 IP 185.91.89.246.35151 > debian-s-1vcpu-1gb-lon1-01.2382: Flags [S], seq 1320584672, win 65535, options [mss 1460,nop,wscale 6,nop,nop,TS val 4030121847 ecr 0,sackOK,eol], length 0
09:28:48.906067 IP debian-s-1vcpu-1gb-lon1-01.2382 > 185.91.89.246.35151: Flags [R.], seq 0, ack 1320584673, win 0, length 0
09:28:48.907762 IP 185.91.89.246.32756 > debian-s-1vcpu-1gb-lon1-01.8082: Flags [S], seq 2170250089, win 65535, options [mss 1460,nop,wscale 6,nop,nop,TS val 3143931748 ecr 0,sackOK,eol], length 0
09:28:48.907789 IP debian-s-1vcpu-1gb-lon1-01.8082 > 185.91.89.246.32756: Flags [R.], seq 0, ack 2170250090, win 0, length 0
09:28:48.908236 IP 185.91.89.246.14894 > debian-s-1vcpu-1gb-lon1-01.1100: Flags [S], seq 3482637312, win 65535, options [mss 1460,nop,wscale 6,nop,nop,TS val 2831452035 ecr 0,sackOK,eol], length 0
09:28:48.908250 IP debian-s-1vcpu-1gb-lon1-01.1100 > 185.91.89.246.14894: Flags [R.], seq 0, ack 3482637313, win 0, length 0
09:28:48.908768 IP 185.91.89.246.55229 > debian-s-1vcpu-1gb-lon1-01.5963: Flags [S], seq 1976111487, win 65535, options [mss 1460,nop,wscale 6,nop,nop,TS val 1312331720 ecr 0,sackOK,eol], length 0
09:28:48.908798 IP debian-s-1vcpu-1gb-lon1-01.5963 > 185.91.89.246.55229: Flags [R.], seq 0, ack 1976111488, win 0, length 0
09:28:48.925513 IP 185.91.89.246.9974 > debian-s-1vcpu-1gb-lon1-01.668: Flags [S], seq 1578263401, win 65535, options [mss 1460,nop,wscale 6,nop,nop,TS val 1506667159 ecr 0,sackOK,eol], length 0
09:28:48.925561 IP debian-s-1vcpu-1gb-lon1-01.668 > 185.91.89.246.9974: Flags [R.], seq 0, ack 1578263402, win 0, length 0
09:28:48.927485 IP 185.91.89.246.9657 > debian-s-1vcpu-1gb-lon1-01.5357: Flags [S], seq 2817125432, win 65535, options [mss 1460,nop,wscale 6,nop,nop,TS val 4046185868 ecr 0,sackOK,eol], length 0
09:28:48.927513 IP debian-s-1vcpu-1gb-lon1-01.5357 > 185.91.89.246.9657: Flags [R.], seq 0, ack 2817125433, win 0, length 0
09:28:48.927917 IP 185.91.89.246.19603 > debian-s-1vcpu-1gb-lon1-01.33: Flags [S], seq 3755262578, win 65535, options [mss 1460,nop,wscale 6,nop,nop,TS val 2094410433 ecr 0,sackOK,eol], length 0
09:28:48.927922 IP debian-s-1vcpu-1gb-lon1-01.33 > 185.91.89.246.19603: Flags [R.], seq 0, ack 3755262579, win 0, length 0
09:28:48.928813 IP 185.91.89.246.4682 > debian-s-1vcpu-1gb-lon1-01.1248: Flags [S], seq 2144010468, win 65535, options [mss 1460,nop,wscale 6,nop,nop,TS val 3492707395 ecr 0,sackOK,eol], length 0
09:28:48.928821 IP debian-s-1vcpu-1gb-lon1-01.1248 > 185.91.89.246.4682: Flags [R.], seq 0, ack 2144010469, win 0, length 0
09:28:48.929914 IP 185.91.89.246.1309 > debian-s-1vcpu-1gb-lon1-01.4111: Flags [S], seq 2188883995, win 65535, options [mss 1460,nop,wscale 6,nop,nop,TS val 2708342654 ecr 0,sackOK,eol], length 0
09:28:48.929930 IP debian-s-1vcpu-1gb-lon1-01.4111 > 185.91.89.246.1309: Flags [R.], seq 0, ack 2188883996, win 0, length 0
09:28:48.944859 IP 185.91.89.246.4846 > debian-s-1vcpu-1gb-lon1-01.2034: Flags [S], seq 1387677745, win 65535, options [mss 1460,nop,wscale 6,nop,nop,TS val 542665325 ecr 0,sackOK,eol], length 0
09:28:48.944904 IP debian-s-1vcpu-1gb-lon1-01.2034 > 185.91.89.246.4846: Flags [R.], seq 0, ack 1387677746, win 0, length 0
09:28:48.947520 IP 185.91.89.246.54195 > debian-s-1vcpu-1gb-lon1-01.1071: Flags [S], seq 1749260525, win 65535, options [mss 1460,nop,wscale 6,nop,nop,TS val 1461419118 ecr 0,sackOK,eol], length 0
09:28:48.947554 IP debian-s-1vcpu-1gb-lon1-01.1071 > 185.91.89.246.54195: Flags [R.], seq 0, ack 1749260526, win 0, length 0
09:28:48.948778 IP 185.91.89.246.4066 > debian-s-1vcpu-1gb-lon1-01.1042: Flags [S], seq 321369643, win 65535, options [mss 1460,nop,wscale 6,nop,nop,TS val 2043096119 ecr 0,sackOK,eol], length 0
09:28:48.948802 IP debian-s-1vcpu-1gb-lon1-01.1042 > 185.91.89.246.4066: Flags [R.], seq 0, ack 321369644, win 0, length 0
09:28:48.949741 IP 185.91.89.246.43512 > debian-s-1vcpu-1gb-lon1-01.9485: Flags [S], seq 214009270, win 65535, options [mss 1460,nop,wscale 6,nop,nop,TS val 3498062109 ecr 0,sackOK,eol], length 0
09:28:48.949766 IP debian-s-1vcpu-1gb-lon1-01.9485 > 185.91.89.246.43512: Flags [R.], seq 0, ack 214009271, win 0, length 0
09:28:48.950129 IP 185.91.89.246.6020 > debian-s-1vcpu-1gb-lon1-01.1217: Flags [S], seq 1066655309, win 65535, options [mss 1460,nop,wscale 6,nop,nop,TS val 1353953079 ecr 0,sackOK,eol], length 0
09:28:48.950147 IP debian-s-1vcpu-1gb-lon1-01.1217 > 185.91.89.246.6020: Flags [R.], seq 0, ack 1066655310, win 0, length 0
09:28:48.966800 IP 185.91.89.246.50289 > debian-s-1vcpu-1gb-lon1-01.593: Flags [S], seq 292781242, win 65535, options [mss 1460,nop,wscale 6,nop,nop,TS val 2216301735 ecr 0,sackOK,eol], length 0
09:28:48.966863 IP debian-s-1vcpu-1gb-lon1-01.593 > 185.91.89.246.50289: Flags [R.], seq 0, ack 292781243, win 0, length 0
09:28:48.967437 IP 185.91.89.246.9779 > debian-s-1vcpu-1gb-lon1-01.18988: Flags [S], seq 104181497, win 65535, options [mss 1460,nop,wscale 6,nop,nop,TS val 2212426398 ecr 0,sackOK,eol], length 0
09:28:48.967467 IP debian-s-1vcpu-1gb-lon1-01.18988 > 185.91.89.246.9779: Flags [R.], seq 0, ack 104181498, win 0, length 0
09:28:48.978464 IP 185.91.89.246.28801 > debian-s-1vcpu-1gb-lon1-01.2323: Flags [S], seq 468416900, win 65535, options [mss 1460,nop,wscale 6,nop,nop,TS val 834772252 ecr 0,sackOK,eol], length 0
09:28:48.978514 IP debian-s-1vcpu-1gb-lon1-01.2323 > 185.91.89.246.28801: Flags [R.], seq 0, ack 468416901, win 0, length 0
09:28:48.981520 IP 185.91.89.246.9125 > debian-s-1vcpu-1gb-lon1-01.1105: Flags [S], seq 4017716300, win 65535, options [mss 1460,nop,wscale 6,nop,nop,TS val 118644441 ecr 0,sackOK,eol], length 0
09:28:48.981569 IP debian-s-1vcpu-1gb-lon1-01.1105 > 185.91.89.246.9125: Flags [R.], seq 0, ack 4017716301, win 0, length 0
09:28:48.983790 IP 185.91.89.246.16473 > debian-s-1vcpu-1gb-lon1-01.1070: Flags [S], seq 4015906719, win 65535, options [mss 1460,nop,wscale 6,nop,nop,TS val 1630863637 ecr 0,sackOK,eol], length 0
